{
  "$schema": "https://json-schema.org/draft/2020-12/schema",
  "$id": "https://rewireperform.com/contracts/production-feedback-activation-preflight-v0.1.schema.json",
  "type": "object",
  "additionalProperties": false,
  "required": [
    "schema_version",
    "status",
    "recorded_date",
    "project_ref",
    "source_main_commit",
    "provenance",
    "migration_state",
    "activation_contracts",
    "registry_state",
    "edge_functions",
    "secret_presence",
    "reader_boundary",
    "upstream_packages",
    "privacy_boundary",
    "gates",
    "authorization_boundary",
    "next_gate"
  ],
  "properties": {
    "schema_version": {
      "const": "rewireperform-feedback-production-activation-preflight-v0.1-evidence-v1"
    },
    "status": {
      "const": "PASS_PRODUCTION_ACTIVATION_CONTRACTS_INSTALLED_CREDENTIALLESS_RUNTIME_CLOSED"
    },
    "recorded_date": {
      "const": "2026-08-13"
    },
    "project_ref": {
      "const": "bqsbxesmybthwtxmowfz"
    },
    "source_main_commit": {
      "const": "62f14138c889c526e6ee180a4f1d76c9a997d9d3"
    },
    "provenance": {
      "const": {
        "source": "sanitized-production-post-install-metadata-and-presence-audit-v1",
        "sanitized_observation_sha256": "b9d015ae5cee6a8f9240f3fc72b9065a8c23f115c8042182df7c4917b89a5630",
        "application_rows_read": false,
        "application_functions_called": false,
        "database_mutated_by_audit": false
      }
    },
    "migration_state": {
      "const": {
        "remote_migration_count": 107,
        "remote_versions_sha256": "6c7caf62ddca94cef7e5b5bd116f18aa2e5696bb9436bf52c74029a9002e26c9",
        "remote_versions": [
          "20260321121030",
          "20260321123715",
          "20260323040239",
          "20260323043306",
          "20260323075612",
          "20260323101245",
          "20260323101337",
          "20260325041755",
          "20260330022045",
          "20260330023424",
          "20260330024409",
          "20260402112102",
          "20260402124823",
          "20260404053340",
          "20260409074644",
          "20260409074705",
          "20260409085440",
          "20260409085509",
          "20260409091340",
          "20260417105852",
          "20260418134458",
          "20260425023436",
          "20260425024353",
          "20260425025352",
          "20260425045425",
          "20260426032123",
          "20260428114308",
          "20260428122846",
          "20260430043441",
          "20260430043545",
          "20260501060824",
          "20260501061036",
          "20260501061142",
          "20260501123726",
          "20260503042016",
          "20260503075749",
          "20260503093104",
          "20260505100954",
          "20260505110430",
          "20260516083900",
          "20260519000000",
          "20260520090000",
          "20260520143000",
          "20260520170000",
          "20260520204746",
          "20260521080000",
          "20260521120000",
          "20260522120000",
          "20260605190000",
          "20260606075234",
          "20260606093000",
          "20260606103000",
          "20260608110000",
          "20260627120000",
          "20260710120000",
          "20260710130000",
          "20260713140500",
          "20260714084351",
          "20260714104145",
          "20260714224000",
          "20260715085749",
          "20260717091518",
          "20260718122735",
          "20260718160000",
          "20260719085701",
          "20260720080000",
          "20260720080100",
          "20260720082309",
          "20260720082953",
          "20260720090000",
          "20260721082355",
          "20260721142328",
          "20260721153000",
          "20260721181524",
          "20260723151225",
          "20260723154047",
          "20260723165153",
          "20260727121946",
          "20260801104717",
          "20260805103400",
          "20260805103500",
          "20260805103600",
          "20260805103650",
          "20260805103700",
          "20260805103840",
          "20260805103900",
          "20260805104000",
          "20260805104100",
          "20260805145921",
          "20260806081925",
          "20260806110000",
          "20260807090000",
          "20260807092005",
          "20260808074346",
          "20260808074742",
          "20260808093000",
          "20260809093000",
          "20260810082841",
          "20260810091629",
          "20260810122000",
          "20260810122100",
          "20260810122749",
          "20260810154932",
          "20260811071836",
          "20260813123955",
          "20260813125221",
          "20260813125222"
        ],
        "controlled_remote_additions": [
          {
            "local_version": "20260813115737",
            "remote_version": "20260813123955",
            "mode": "CONTROLLED_VERSION_MAPPING_EXACT_BYTES",
            "local_path": "supabase/migrations/20260813115737_feedback_consent_guardian_de_v1_1_final_contract.sql",
            "local_sha256": "6a2933e3d33a41fe0c35523be795160c04f030dfccf3f4579078fabb0784eba9"
          },
          {
            "local_version": "20260813125221",
            "remote_version": "20260813125221",
            "mode": "APPLIED_EXACT_VERSION_AND_BYTES",
            "local_path": "supabase/migrations/20260813125221_feedback_intelligence_v1_1_activation_contract.sql",
            "local_sha256": "960d5809ed248c05c5f7e64b36fdf0f12a160f9e9f7b3a3c663bda434e375ba4"
          },
          {
            "local_version": "20260813125222",
            "remote_version": "20260813125222",
            "mode": "APPLIED_EXACT_VERSION_AND_BYTES",
            "local_path": "supabase/migrations/20260813125222_feedback_intelligence_v1_1_reclose_contract.sql",
            "local_sha256": "be999f2f69b9c6c75abde320a8d3521ca4425c2db0426cf32c629c918205278b"
          }
        ]
      }
    },
    "activation_contracts": {
      "const": {
        "installed_function_count": 2,
        "functions": {
          "feedback_core.activate_feedback_v1_1(text)": {
            "installed": true,
            "security_mode": "INVOKER",
            "public_execute": false,
            "anon_execute": false,
            "authenticated_execute": false,
            "service_role_execute": false,
            "source_migration": "supabase/migrations/20260813125221_feedback_intelligence_v1_1_activation_contract.sql",
            "source_sha256": "960d5809ed248c05c5f7e64b36fdf0f12a160f9e9f7b3a3c663bda434e375ba4"
          },
          "feedback_core.reclose_feedback_v1_1(text)": {
            "installed": true,
            "security_mode": "INVOKER",
            "public_execute": false,
            "anon_execute": false,
            "authenticated_execute": false,
            "service_role_execute": false,
            "source_migration": "supabase/migrations/20260813125222_feedback_intelligence_v1_1_reclose_contract.sql",
            "source_sha256": "be999f2f69b9c6c75abde320a8d3521ca4425c2db0426cf32c629c918205278b"
          }
        },
        "runtime_state_changed_by_installation": false
      }
    },
    "registry_state": {
      "const": {
        "campaigns": {
          "count": 4,
          "references": [
            "feedback-day-10-v1",
            "feedback-day-24-v1",
            "feedback-day-39-v1",
            "feedback-day-55-v1"
          ],
          "status": "draft",
          "active_count": 0,
          "content_version": "feedback-intelligence-content-v1.1.2",
          "consent_version": "feedback-text-consent-v1.1.0"
        },
        "guardian_policy": {
          "count": 1,
          "policy_reference": "guardian-feedback-text-de-v1.1.0",
          "status": "draft",
          "active_count": 0
        },
        "runtime_gates": {
          "athlete_collection_enabled": false,
          "text_collection_enabled": false,
          "privacy_notice_ready": false,
          "app_store_declaration_ready": false,
          "minor_policy_ready": false
        }
      }
    },
    "edge_functions": {
      "const": {
        "mahleos-feedback-intelligence-production-read": {
          "id": "1daee0c6-0831-4136-80ca-796e7a7ac1e3",
          "version": 1,
          "status": "ACTIVE",
          "verify_jwt": false,
          "deployment_digest_sha256": "32f1d1f2c847fec8cf31f5821ead3c8e7e3d977fdf7d039964280be07e50503c",
          "remote_files": {
            "supabase/functions/mahleos-feedback-intelligence-production-read/index.ts": "71767f232ca00c7e3def5c51683b47c7512130fb538197cf879ff5027261d1ae",
            "supabase/functions/_shared/feedbackIntelligenceProductionMachineAuth.ts": "0f120f08fafc95a6373f563f196ccd0efd06d1b4e9743eae3e3d45478a856f00",
            "supabase/functions/_shared/feedbackIntelligenceMachineAuthCore.ts": "78a3685d1b18e1fb5e70faf9fbc66dd6a419a5dc22a9cde18b78c9df6dda1ea1",
            "supabase/functions/_shared/feedbackIntelligenceGatewayHttp.ts": "61690142b2ff292a2bc82d60327332a5e93479da529f5462504a5a344792f0d8",
            "supabase/functions/_shared/feedbackIntelligenceProductionDatabase.ts": "735c670c9e6ed4994d0b12b5d23d617f038a85674d2dde4a9c2cb97e9d11a5e4",
            "supabase/functions/_shared/boundedRequestBody.ts": "7a707eb6a54df88e2314439658aca1fb53f7c666f53d58fd6a1dfd241323568e"
          }
        },
        "submit-organization-access-request": {
          "id": "a81e37b6-7e58-4a78-8f45-0da426a073d7",
          "version": 2,
          "status": "ACTIVE",
          "verify_jwt": false,
          "deployment_digest_sha256": "96a2d7bdbd97b17700198890afe747f6554ee412ac62718e2032785d1a6c583a",
          "remote_files": {
            "supabase/functions/submit-organization-access-request/index.ts": "1b6d9600f81bfa97ef7c979a1e689df4f02c4cc3eb8b2ced2be8f8da1ed58234",
            "supabase/functions/_shared/supabaseService.ts": "5310e93594f4088266845f21472b6c6f77d3b67e8bc26191b916e84dc2c4cd9e",
            "supabase/functions/_shared/boundedRequestBody.ts": "7a707eb6a54df88e2314439658aca1fb53f7c666f53d58fd6a1dfd241323568e"
          }
        }
      }
    },
    "secret_presence": {
      "const": {
        "source": "supabase-secrets-list-presence-only-v1",
        "expected_secret_names": [
          "MAHLEOS_FEEDBACK_PRODUCTION_MACHINE_KEY",
          "MAHLEOS_FEEDBACK_PRODUCTION_MACHINE_KEY_PREVIOUS",
          "MAHLEOS_FEEDBACK_PRODUCTION_READER_DATABASE_URL",
          "MAHLEOS_FEEDBACK_PRODUCTION_MACHINE_GATE",
          "MAHLEOS_FEEDBACK_PRODUCTION_REAL_DATA_GATE"
        ],
        "observed_presence": {
          "MAHLEOS_FEEDBACK_PRODUCTION_MACHINE_KEY": false,
          "MAHLEOS_FEEDBACK_PRODUCTION_MACHINE_KEY_PREVIOUS": false,
          "MAHLEOS_FEEDBACK_PRODUCTION_READER_DATABASE_URL": false,
          "MAHLEOS_FEEDBACK_PRODUCTION_MACHINE_GATE": false,
          "MAHLEOS_FEEDBACK_PRODUCTION_REAL_DATA_GATE": false
        },
        "secret_values_read": false,
        "secret_values_persisted": false,
        "unrelated_secret_names_persisted": false
      }
    },
    "reader_boundary": {
      "const": {
        "source": "postgres-catalog-metadata-audit-v1",
        "role_name": "mahleos_feedback_production_reader",
        "password_is_null": true,
        "login": true,
        "superuser": false,
        "createdb": false,
        "createrole": false,
        "inherit": false,
        "replication": false,
        "bypassrls": false,
        "callable_rpc_count": 1,
        "relation_privilege_count": 0,
        "sequence_privilege_count": 0,
        "public_callable_path_count": 0
      }
    },
    "upstream_packages": {
      "const": {
        "consent_postdeploy_manifest_sha256": "bb0000aa8ecba0baed89ff8338af64bb354656ba9e10595848d8715dd2f26f7f",
        "consent_postdeploy_package_sha256": "478a3aff35f7280d30faf87cfcc9f13bc29ffa47d8f84ddaa8081f8275a57842",
        "activation_smoke_manifest_sha256": "432e5b4da8fa6655949a16a88c281b9a5a22bb9809f4485c5c0f0b74e3643705",
        "activation_smoke_package_sha256": "c6782775a9f809705d994b33b84f7d68d754ba50b5370ce1b97783d68e11d415",
        "production_gateway_manifest_sha256": "5377f12f986b1cced7b442fa17b8486f9a11e606d4e7c44e67871c19d799f04a",
        "production_gateway_package_sha256": "3c131f36ef1b2f62725f879a8694bcdadcea7d85de6f5ce93fdad4198fd978b4",
        "historical_credentialless_preflight_manifest_sha256": "ea795f9e0e71e3cb6c7ce5bc48fe9a105cbba2986a63e072716f0fce34680a7f",
        "historical_credentialless_preflight_package_sha256": "15a30cbc5caf508338c033f89cf87e3bc1cb62b7bb2cfa5ac93686a3c57a99f9"
      }
    },
    "privacy_boundary": {
      "const": {
        "metadata_and_presence_only": true,
        "application_rows_read": false,
        "application_values_persisted": false,
        "raw_feedback_read": false,
        "raw_comment_text_read": false,
        "subject_reference_read": false,
        "secret_values_read": false,
        "credential_values_persisted": false,
        "database_mutated_by_audit": false
      }
    },
    "gates": {
      "type": "object",
      "additionalProperties": false,
      "required": [
        "campaigns_active",
        "guardian_policy_active",
        "feedback_credentials",
        "feedback_machine_runtime",
        "feedback_real_data",
        "feedback_collection",
        "feedback_comments",
        "minor_feedback",
        "guardian_feedback",
        "real_jarvis",
        "app_store_action",
        "production_activation",
        "synthetic_smoke"
      ],
      "properties": {
        "campaigns_active": {
          "const": false
        },
        "guardian_policy_active": {
          "const": false
        },
        "feedback_credentials": {
          "const": false
        },
        "feedback_machine_runtime": {
          "const": false
        },
        "feedback_real_data": {
          "const": false
        },
        "feedback_collection": {
          "const": false
        },
        "feedback_comments": {
          "const": false
        },
        "minor_feedback": {
          "const": false
        },
        "guardian_feedback": {
          "const": false
        },
        "real_jarvis": {
          "const": false
        },
        "app_store_action": {
          "const": false
        },
        "production_activation": {
          "const": false
        },
        "synthetic_smoke": {
          "const": false
        }
      }
    },
    "authorization_boundary": {
      "type": "object",
      "additionalProperties": false,
      "required": [
        "authorizes_activation",
        "authorizes_synthetic_smoke",
        "authorizes_credentials",
        "authorizes_feedback_read",
        "authorizes_minor_or_guardian_collection",
        "authorizes_real_data_processing",
        "authorizes_app_store_action"
      ],
      "properties": {
        "authorizes_activation": {
          "const": false
        },
        "authorizes_synthetic_smoke": {
          "const": false
        },
        "authorizes_credentials": {
          "const": false
        },
        "authorizes_feedback_read": {
          "const": false
        },
        "authorizes_minor_or_guardian_collection": {
          "const": false
        },
        "authorizes_real_data_processing": {
          "const": false
        },
        "authorizes_app_store_action": {
          "const": false
        }
      }
    },
    "next_gate": {
      "const": "INDEPENDENT_JARVIS_CONSUMER_BYTE_AND_SEMANTIC_ACCEPTANCE_REQUIRED"
    }
  }
}
